{
  "$schema": "https://json-schema.org/draft/2020-12/schema",
  "$id": "https://raw.githubusercontent.com/gabrielmsilva00/docmedown/main/schemas/docs.schema.json",
  "title": "DocMeDown documentation configuration",
  "description": "Configuration for a DocMeDown documentation root. A directory containing docs.json is an independent documentation site.",
  "type": "object",
  "additionalProperties": false,
  "properties": {
    "$schema": { "type": "string", "format": "uri" },
    "name": { "type": "string", "minLength": 1 },
    "tagline": { "type": "string" },
    "description": { "type": "string" },
    "url": {
      "type": "string",
      "format": "uri",
      "description": "Canonical site origin (e.g. https://docs.example.com). Enables sitemap.xml, robots.txt, canonical links, and absolute Open Graph URLs."
    },
    "version": { "type": "string" },
    "rootDoc": { "type": "string", "minLength": 1 },
    "i18n": {
      "type": "object", "additionalProperties": false,
      "properties": {
        "defaultLocale": { "type": "string", "minLength": 2, "default": "en" },
        "locales": {
          "type": "array",
          "items": {
            "type": "object", "additionalProperties": false, "required": ["code"],
            "properties": {
              "code": { "type": "string", "minLength": 2 },
              "label": { "type": "string", "minLength": 1 },
              "overrides": {
                "type": "object", "additionalProperties": false,
                "properties": {
                  "tagline": { "type": "string" }, "description": { "type": "string" },
                  "nav": { "$ref": "#/properties/nav" }, "sidebar": { "$ref": "#/properties/sidebar" },
                  "search": { "$ref": "#/properties/search" }, "footer": { "$ref": "#/properties/footer" }
                }
              }
            }
          }
        },
        "fallbackToDefault": { "type": "boolean", "default": true },
        "showUntranslated": { "type": "boolean", "default": false, "description": "Whether to include untranslated language options with a fallback indicator in the language dropdown." }
      }
    },
    "home": {
      "type": "string",
      "minLength": 1,
      "description": "Documentation home document (path or slug) or an explicit link. Defaults to README.md, PROJECT.md, ABOUT.md, or INDEX.md at the documentation root (case-sensitive pass first, then case-insensitive), then the alphabetically first Markdown document."
    },
    "source": { "$ref": "#/$defs/source" },
    "theme": { "$ref": "#/$defs/theme" },
    "nav": { "type": "array", "items": { "$ref": "#/$defs/navLink" } },
    "socials": { "type": "array", "items": { "$ref": "#/$defs/socialLink" } },
    "sidebar": { "type": "array", "items": { "$ref": "#/$defs/sidebarItem" } },
    "autoIndex": { "$ref": "#/$defs/autoIndex" },
    "search": { "$ref": "#/$defs/search" },
    "offline": { "$ref": "#/$defs/offline" },
    "footer": { "$ref": "#/$defs/footer" },
    "editor": { "$ref": "#/$defs/editor" },
    "componentsUrl": { "type": "string" },
    "editUrl": { "type": "string" }
  },
  "$defs": {
    "navLink": {
      "type": "object",
      "additionalProperties": false,
      "required": ["label", "href"],
      "properties": {
        "label": { "type": "string", "minLength": 1 },
        "href": { "type": "string", "minLength": 1 },
        "external": { "type": "boolean" },
        "icon": { "type": "string" }
      }
    },
    "socialLink": {
      "type": "object",
      "additionalProperties": false,
      "required": ["type", "url"],
      "properties": {
        "type": { "enum": ["github", "gitlab", "twitter", "x", "discord", "custom"] },
        "url": { "type": "string", "format": "uri" },
        "label": { "type": "string" },
        "icon": { "type": "string" }
      }
    },
    "source": {
      "oneOf": [
        {
          "type": "object",
          "additionalProperties": false,
          "required": ["type", "repo"],
          "properties": {
            "type": { "const": "github" },
            "repo": { "type": "string", "pattern": "^[^/\\s]+/[^/\\s]+$" },
            "branch": { "type": "string", "minLength": 1 },
            "docsDir": { "type": "string" },
            "token": { "type": "string" },
            "baseUrl": { "type": "string", "format": "uri" }
          }
        },
        {
          "type": "object",
          "additionalProperties": false,
          "required": ["type", "repo"],
          "properties": {
            "type": { "const": "gitlab" },
            "repo": { "type": "string", "pattern": "^[^/\\s]+/[^/\\s]+$" },
            "branch": { "type": "string", "minLength": 1 },
            "docsDir": { "type": "string" },
            "token": { "type": "string" },
            "baseUrl": { "type": "string", "format": "uri" }
          }
        },
        {
          "type": "object",
          "additionalProperties": false,
          "required": ["type", "baseUrl"],
          "properties": {
            "type": { "const": "raw" },
            "baseUrl": { "type": "string", "format": "uri" },
            "branch": { "type": "string", "minLength": 1 },
            "docsDir": { "type": "string" },
            "token": { "type": "string" }
          }
        }
      ]
    },
    "theme": {
      "type": "object",
      "additionalProperties": false,
      "properties": {
        "family": {
          "enum": ["atlas", "blueprint", "terminal", "editorial", "botanical", "studio"],
          "description": "Complete visual system controlling canvas, geometry, typography rhythm and motion."
        },
        "density": { "enum": ["comfortable", "compact"], "description": "Reading density across shell panels." },
        "preset": {
          "enum": ["indigo", "emerald", "sunset", "violet", "rose", "slate", "cyberpunk"],
          "deprecated": true,
          "description": "Legacy accent preset. Mapped automatically onto theme.family; use family instead."
        },
        "defaultMode": { "enum": ["light", "dark", "auto"] },
        "accentColor": { "type": "string" },
        "accentColorDark": { "type": "string" },
        "fontFamily": { "type": "string" },
        "codeTheme": { "enum": ["github", "dracula", "one-dark", "synthwave"] },
        "favicon": { "type": "string" },
        "logo": {
          "type": "object",
          "additionalProperties": false,
          "properties": {
            "light": { "type": "string" },
            "dark": { "type": "string" },
            "alt": { "type": "string" },
            "text": { "type": "string" }
          }
        }
      }
    },
    "autoIndex": {
      "type": "object",
      "additionalProperties": false,
      "properties": {
        "enabled": { "type": "boolean" },
        "exclude": { "type": "array", "items": { "type": "string", "minLength": 1 } },
        "sort": { "enum": ["alphabetical", "frontmatter", "natural"] },
        "defaultCollapsed": { "type": "boolean" }
      }
    },
    "search": {
      "type": "object",
      "additionalProperties": false,
      "properties": {
        "enabled": { "type": "boolean" },
        "placeholder": { "type": "string" },
        "maxResults": { "type": "integer", "minimum": 1, "maximum": 100 }
      }
    },
    "offline": {
      "type": "object",
      "additionalProperties": false,
      "properties": {
        "embedNestedDocs": {
          "type": "boolean",
          "description": "Embed nested documentation sites into the single-file offline bundle so no external files are needed. Defaults to true; when false, links to other documentation files render as disabled links offline."
        }
      }
    },
    "footer": {
      "type": "object",
      "additionalProperties": false,
      "properties": {
        "copyright": { "type": "string" },
        "links": { "type": "array", "items": { "$ref": "#/$defs/navLink" } },
        "showBuiltWith": { "type": "boolean" }
      }
    },
    "editor": {
      "type": "object",
      "additionalProperties": false,
      "description": "Browser editor availability. The editor is additionally gated by the dev server: it only appears when served locally with editor access granted, never on static hosts or offline bundles.",
      "properties": {
        "enabled": {
          "type": "boolean",
          "default": true,
          "description": "Allow the in-browser 2-way editor when served by the local dev server."
        }
      }
    },
    "sidebarItem": {
      "type": "object",
      "additionalProperties": false,
      "properties": {
        "title": { "type": "string" },
        "path": { "type": "string" },
        "slug": { "type": "string" },
        "icon": { "type": "string" },
        "badge": { "type": "string" },
        "badgeType": { "enum": ["info", "success", "warning", "new"] },
        "collapsed": { "type": "boolean" },
        "children": { "type": "array", "items": { "$ref": "#/$defs/sidebarItem" } }
      }
    }
  }
}