{
  "$schema": "https://raw.githubusercontent.com/gabrielmsilva00/docmedown/main/schemas/docs.schema.json",
  "name": "React Repository Reader",
  "tagline": "An isolated nested site sourced from GitHub",
  "description": "A remote-source example with its own configuration and component directory.",
  "version": "Example",
  "rootDoc": "README.md",
  "source": {
    "type": "github",
    "repo": "facebook/react",
    "branch": "main",
    "docsDir": ""
  },
  "theme": {
    "family": "blueprint",
    "density": "comfortable",
    "defaultMode": "auto",
    "codeTheme": "github"
  },
  "nav": [
    { "label": "Overview", "href": "#/README" },
    { "label": "GitHub Repo", "href": "https://github.com/facebook/react", "external": true }
  ],
  "socials": [
    { "type": "github", "url": "https://github.com/facebook/react" }
  ],
  "search": {
    "enabled": true,
    "placeholder": "Search the remote repository..."
  }
}
